Name, Description, Authors, Repository, Homepage, Documentation, Download Page, Coding Language, License, Operating System, Pricing Model
afmformats, Python library for reading common AFM file formats, Paul M체ller, https://github.com/AFM-analysis/afmformats, , https://afmformats.readthedocs.io, https://pypi.org/project/afmformats, Python, MIT, Linux Windows macOS, 
Gwyddion, , David Ne훾as and Petr Klapetek, https://sourceforge.net/projects/gwyddion/, http://gwyddion.net/, http://gwyddion.net/documentation/, http://gwyddion.net/download.php, C, GPL, Linux Windows macOS, 
nanite, Fitting and machine-learning based rating of AFM force-indentation data, Paul M체ller, https://github.com/AFM-analysis/nanite, , https://nanite.readthedocs.io, https://pypi.org/project/nanite, Python, GPL, Linux Windows macOS, 
PyJibe, GUI for AFM data analysis with an emphasis on biological specimens, Paul M체ller, https://github.com/AFM-analysis/PyJibe, , https://pyjibe.readthedocs.io, https://github.com/AFM-analysis/PyJibe/releases, Python, GPL, Linux Windows macOS, 
TopoStats, , TopoStats Developers, https://github.com/AFM-SPM/TopoStats, , , , Python, LGPL, Linux Windows macOS, 
